<?xml version="1.0" encoding="UTF-8"?>
<msg_0x01 messageNo="0" messageSequenceNo="0" messageSerialNo="0"
	xmlns="http://www.ambimmort.com/msg_0x01" xmlns:u="http://www.ambimmort.com/UType"
	xmlns:xsi="http://www.w3.org/2001/XMLSchema-instance"
	xsi:schemaLocation="http://www.ambimmort.com/msg_0x01 msg_0x01.xsd ">
	<PacketType>1</PacketType>
	<PacketSubtype>196</PacketSubtype>
	<R_StartTime>0</R_StartTime>
	<R_EndTime>0</R_EndTime>
	<R_Freq>1</R_Freq>
	<R_DestIP>
		<u:IPType>IPv4</u:IPType>
		<u:IPv4Address>111.228.250.176</u:IPv4Address>
	</R_DestIP>
	<R_DestPort>60002</R_DestPort>
	<R_Method>1</R_Method>
	<UserName></UserName>
	<Password></Password>
	<MessageSerialNo>1</MessageSerialNo>
</msg_0x01>
